{
  "actor": "shubhodeep1",
  "command": "answer",
  "comment_id": 6069287980,
  "entry_id": "processed_command_6808_6069287980_answer",
  "issue_number": 6808,
  "metadata": {
    "answer_comment_id": 6069372827,
    "answer_hash": "fe6ed13081a1c92f0b27260de9568626e6fac923a23aa53e8617d40c0584ce09",
    "clarify_comment_id": 6069287980,
    "clarify_hash": "65a1ab2640f39b822aa982955f8b96fc739a54b93b90f7a6cf0ff86240de2e6d",
    "cycle": 1,
    "issue_url": "https://github.com/shubhodeep1/coding-workflows/issues/6808",
    "loop_block_reason": "none",
    "loop_blocked": false,
    "run_url": "https://github.com/shubhodeep1/coding-workflows/actions/runs/37846167931"
  },
  "run_attempt": 1,
  "run_id": "37846167931",
  "schema_version": "processed_command_entry.v1",
  "status": "answered",
  "timestamp": "2026-10-08T21:28:17Z",
  "workflow": "orchestrate_clarify_respond"
}
