{
  "actor": "shubhodeep1",
  "command": "answer",
  "comment_id": 6035490813,
  "entry_id": "processed_command_6623_6035490813_answer",
  "issue_number": 6623,
  "metadata": {
    "clarify_comment_id": 6035490813,
    "issue_url": "https://github.com/shubhodeep1/coding-workflows/issues/6623",
    "run_url": "https://github.com/shubhodeep1/coding-workflows/actions/runs/37603889461"
  },
  "run_attempt": 1,
  "run_id": "37603889461",
  "schema_version": "processed_command_entry.v1",
  "status": "claimed",
  "timestamp": "2026-10-07T10:00:36Z",
  "workflow": "orchestrate_clarify_respond"
}
