{
  "actor": "shubhodeep1",
  "command": "answer",
  "comment_id": 6040548730,
  "entry_id": "processed_command_6623_6040548730_answer",
  "issue_number": 6623,
  "metadata": {},
  "run_attempt": 1,
  "run_id": "37640207520",
  "schema_version": "processed_command_entry.v1",
  "status": "blocked",
  "timestamp": "2026-10-07T15:00:19Z",
  "workflow": "plan"
}
