{
  "actor": "shubhodeep1",
  "command": "answer",
  "comment_id": 6229735736,
  "entry_id": "processed_command_7540_6229735736_answer",
  "issue_number": 7540,
  "metadata": {},
  "run_attempt": 1,
  "run_id": "39003415468",
  "schema_version": "processed_command_entry.v1",
  "status": "claimed",
  "timestamp": "2026-10-17T04:42:27Z",
  "workflow": "plan"
}
