{
  "actor": "shubhodeep1",
  "command": "approved",
  "comment_id": 5762649253,
  "entry_id": "processed_command_4228_5762649253_approved",
  "issue_number": 4228,
  "metadata": {
    "branch": "ai/issue-4228",
    "changed_files": [
      ".ai/.workspace_source_manifest.txt",
      ".github/workflows/mark-stable.yml",
      ".github/workflows/test-and-mark-stable.yml",
      "changelog.d/4228-release-creation-token-recovery.md",
      "tests/test_mark_stable_release_tag_refspec_contract.py"
    ],
    "issue_number": 4228,
    "issue_url": "https://github.com/shubhodeep1/coding-workflows/issues/4228",
    "pr_number": 4229,
    "pr_url": "https://github.com/shubhodeep1/coding-workflows/pull/4229",
    "run_attempt": "1",
    "run_id": "35616156169",
    "run_url": "https://github.com/shubhodeep1/coding-workflows/actions/runs/35616156169"
  },
  "run_attempt": 1,
  "run_id": "35616156169",
  "schema_version": "processed_command_entry.v1",
  "status": "completed",
  "timestamp": "2026-09-21T15:18:04Z",
  "workflow": "implement"
}
