{
  "actor": "shubhodeep1",
  "command": "approved",
  "comment_id": 4265276337,
  "entry_id": "processed_command_1256_4265276337_approved",
  "issue_number": 1256,
  "metadata": {
    "issue_url": "https://github.com/shubhodeep1/coding-workflows/issues/1256",
    "run_url": "https://github.com/shubhodeep1/coding-workflows/actions/runs/24547390468"
  },
  "run_attempt": 1,
  "run_id": "24547390468",
  "schema_version": "processed_command_entry.v1",
  "status": "claimed",
  "timestamp": "2026-04-17T04:18:08Z",
  "workflow": "implement"
}
