{
  "actor": "shubhodeep1",
  "command": "answer",
  "comment_id": 4797920127,
  "entry_id": "processed_command_3507_4797920127_answer",
  "issue_number": 3507,
  "metadata": {},
  "run_attempt": 1,
  "run_id": "28161595551",
  "schema_version": "processed_command_entry.v1",
  "status": "completed",
  "timestamp": "2026-06-25T09:54:49Z",
  "workflow": "plan"
}
