{
  "actor": "shubhodeep1",
  "command": "approved",
  "comment_id": 6009319846,
  "entry_id": "processed_command_6483_6009319846_approved",
  "issue_number": 6483,
  "metadata": {
    "branch": "ai/issue-6483",
    "changed_files": [
      ".ai/.workspace_source_manifest.txt",
      ".github/workflows/review_autofix.yml",
      "README.md",
      "agents.md",
      "changelog.d/6483-security-hold-followups-alert.md",
      "scripts/review_single_issue_security_pass.sh",
      "tests/test_review_rb_judge_security_pass.py",
      "tests/test_single_issue_security_pass.py"
    ],
    "issue_number": 6483,
    "issue_url": "https://github.com/shubhodeep1/coding-workflows/issues/6483",
    "pr_number": 6489,
    "pr_url": "https://github.com/shubhodeep1/coding-workflows/pull/6489",
    "run_attempt": "1",
    "run_id": "37413698162",
    "run_url": "https://github.com/shubhodeep1/coding-workflows/actions/runs/37413698162"
  },
  "run_attempt": 1,
  "run_id": "37413698162",
  "schema_version": "processed_command_entry.v1",
  "status": "completed",
  "timestamp": "2026-10-06T04:46:51Z",
  "workflow": "implement"
}
