{
  "actor": "shubhodeep1",
  "command": "approved",
  "comment_id": 6082091223,
  "entry_id": "processed_command_6943_6082091223_approved",
  "issue_number": 6943,
  "metadata": {
    "branch": "ai/issue-6943",
    "changed_files": [
      ".github/workflows/ci.yml",
      ".github/workflows/mark-stable.yml",
      ".github/workflows/test-and-mark-stable.yml",
      "agents.md",
      "changelog.d/6943-release-manifest-attest.md",
      "docs/INVENTORY.md",
      "scripts/release_manifest_publish.sh",
      "tests/test_release_manifest_workflow_contract.py"
    ],
    "issue_number": 6943,
    "issue_url": "https://github.com/shubhodeep1/coding-workflows/issues/6943",
    "pr_number": 6949,
    "pr_url": "https://github.com/shubhodeep1/coding-workflows/pull/6949",
    "run_attempt": "1",
    "run_id": "37938511581",
    "run_url": "https://github.com/shubhodeep1/coding-workflows/actions/runs/37938511581"
  },
  "run_attempt": 1,
  "run_id": "37938511581",
  "schema_version": "processed_command_entry.v1",
  "status": "completed",
  "timestamp": "2026-10-09T14:01:09Z",
  "workflow": "implement"
}
