{
  "actor": "shubhodeep1",
  "command": "approved",
  "comment_id": 6285583194,
  "entry_id": "processed_command_7729_6285583194_approved",
  "issue_number": 7729,
  "metadata": {
    "branch": "ai/issue-7729",
    "changed_files": [
      "README.md",
      "analysis/recommendation-processing-report.md",
      "analysis/workflow-optimization-2026-09-22.md",
      "changelog.d/wfopt-0922-final-report.md"
    ],
    "issue_number": 7729,
    "issue_url": "https://github.com/shubhodeep1/coding-workflows/issues/7729",
    "pr_number": 7730,
    "pr_url": "https://github.com/shubhodeep1/coding-workflows/pull/7730",
    "run_attempt": "1",
    "run_id": "39385651684",
    "run_url": "https://github.com/shubhodeep1/coding-workflows/actions/runs/39385651684"
  },
  "run_attempt": 1,
  "run_id": "39385651684",
  "schema_version": "processed_command_entry.v1",
  "status": "completed",
  "timestamp": "2026-10-20T07:35:30Z",
  "workflow": "implement"
}
